{
  "schemaVersion": "1.0.0",
  "workflowId": "WF-P4-CONTINUATION-20260911",
  "runId": "RUN-P4-PLAN-20260911-01",
  "status": "planned",
  "currentStep": 1,
  "totalSteps": 17,
  "activeSkill": "workflow-recovery",
  "lastCompletedStep": 0,
  "resumeFromStep": 1,
  "lastSequence": 32,
  "updatedAt": "2026-09-11T11:47:46.850Z"
}